{
  "id": "src-mitanni-unesco-21-seed-l",
  "entity": "source",
  "type": "institutional",
  "citation": "UNESCO WHC — Ancient City of Aleppo (21) Seed L — northern Syria regional orientation.",
  "url": "https://whc.unesco.org/en/list/21/",
  "access_date": "2026-10-13",
  "reliability_tier": "T",
  "notes": "WHC 21; N Syria orientation.",
  "editorial": {
    "derived_from": [
      "tools/hot_densify/densify_seed_batch_l.py",
      "docs/coverage-map.md",
      "docs/decisions.md#d-2026-10-13-06"
    ],
    "derived_on": "2026-10-13",
    "notes": "Seed densify Batch L toward ~71 sources (D-2026-10-13-06). No invented pages/coords/finds/media. Status stays library-seed-rich."
  }
}
