{
  "id": "src-waf-mcintosh-sj-orientation",
  "entity": "source",
  "type": "monograph",
  "citation": "McIntosh, Susan Keech — Jenné-jeno and Middle Niger urbanism excavation syntheses.",
  "url": null,
  "access_date": null,
  "reliability_tier": "S",
  "notes": "P/S excavation synthesis orientation for Jenné-jeno.",
  "editorial": {
    "derived_from": [
      "tools/wave3_shells/densify_wave3.py",
      "docs/coverage-map.md",
      "docs/decisions.md#d-2026-10-12-17"
    ],
    "derived_on": "2026-10-12",
    "notes": "Wave-3 densify to library-seed-rich (D-2026-10-12-17). No invented pages/coords/finds/media art. Honest thin > fake dense."
  }
}
