{
  "id": "src-zimbabwe-enclosure-seed-n",
  "entity": "source",
  "type": "article",
  "citation": "Great Enclosure Seed N.",
  "url": null,
  "access_date": null,
  "reliability_tier": "S",
  "notes": "Enclosure.",
  "editorial": {
    "derived_from": [
      "tools/hot_densify/densify_seed_batch_n.py",
      "docs/coverage-map.md",
      "docs/decisions.md#d-2026-10-13-08"
    ],
    "derived_on": "2026-10-13",
    "notes": "Seed densify Batch N toward ~71 sources (D-2026-10-13-08). No invented pages/coords/finds/media. Status stays library-seed-rich."
  }
}
