{
  "id": "src-cahokia-unesco-198",
  "entity": "source",
  "type": "web",
  "citation": "UNESCO World Heritage Centre. Cahokia Mounds State Historic Site. Inscribed 1982. https://whc.unesco.org/en/list/198/",
  "url": "https://whc.unesco.org/en/list/198/",
  "access_date": "2026-10-12",
  "reliability_tier": "T",
  "notes": "WHC orientation for Cahokia Mounds; tier T.",
  "editorial": {
    "derived_from": [
      "tools/wave3_shells/generate_wave3.py",
      "docs/coverage-map.md",
      "docs/decisions.md#d-2026-10-12-15"
    ],
    "derived_on": "2026-10-12",
    "notes": "Wave-3 library-seed shell (D-2026-10-12-15). Abstract/TOC-level claims only; no invented pages, coords, or finds."
  }
}
