{
  "id": "src-mesopotamia-parrot-tello-1948",
  "entity": "source",
  "type": "monograph",
  "citation": "Parrot, André. 1948. Tello: vingt campagnes de fouilles (1877–1933). Paris: Albin Michel.",
  "url": "https://archive.org/details/tellovingtcampag00parr",
  "access_date": "2026-10-11",
  "reliability_tier": "S",
  "notes": "Strong secondary synthesis of twenty French excavation campaigns at Tello (ancient Girsu), 1877–1933, with bibliography pp. 319–358 in the printed edition. Digitized copy on Internet Archive (accessed 2026-10-11). Not a single-season field notebook substitute; use for campaign history and published find classes, and cross-check with later specialist studies.",
  "editorial": {
    "derived_from": [
      "sources/src-mesopotamia-parrot-tello-1948.md"
    ],
    "derived_on": "2026-10-11",
    "notes": "Copied from source registry; bibliographic details verified via public catalogs 2026-10-11."
  }
}
