{
  "id": "src-classic-maya-chase-caracol-1987",
  "entity": "source",
  "type": "excavation-report",
  "citation": "Chase, Arlen F., and Diane Z. Chase. 1987. Investigations at the Classic Maya City of Caracol, Belize: 1985–1987. Pre-Columbian Art Research Institute Monograph 3.",
  "url": "https://www.mesoweb.com/pari/publications/monographs/03/Monograph3.pdf",
  "access_date": "2026-10-12",
  "reliability_tier": "P",
  "notes": "OA excavation monograph PDF via Mesoweb/PARI.",
  "editorial": {
    "derived_from": [
      "tools/wave2_shells/generate_wave2.py",
      "docs/coverage-map.md",
      "docs/decisions.md#d-2026-10-12-14"
    ],
    "derived_on": "2026-10-12",
    "notes": "Wave-2 library-seed shell (D-2026-10-12-14). Abstract/TOC-level claims only; no invented pages, coords, or finds."
  }
}
