{
  "id": "src-aegean-mylonas-grave-circle-b-1973",
  "entity": "source",
  "type": "excavation-report",
  "citation": "Mylonas, George E. 1972–1973. Ο ταφικός κύκλος Β των Μυκηνών [The Grave Circle B of Mycenae]. 2 vols. (text and plates). Library of the Archaeological Society at Athens 73. Athens: Archaeological Society at Athens.",
  "url": "https://www.e-mycenae.org/grave-circle-b/",
  "access_date": "2026-10-12",
  "reliability_tier": "P",
  "notes": "Primary Archaeological Society publication of Grave Circle B (excavated 1952–54 with Papadimitriou). Site page verified 2026-10-12. Shaft-grave chronology refined by later Aegean absolute dating debates.",
  "editorial": {
    "derived_from": [
      "sources/src-aegean-mylonas-grave-circle-b-1973.md"
    ],
    "derived_on": "2026-10-12",
    "notes": "Density pass 4 (D-2026-10-12-4); bibliographic details verified via WebSearch/catalog pages 2026-10-12; no invented page numbers/coordinates/forged images."
  }
}
