{
  "id": "src-olmec-stirling-bae-157-1955",
  "entity": "source",
  "type": "excavation-report",
  "citation": "Stirling, Matthew W. 1955. Stone Monuments of the Rio Chiquito, Veracruz, Mexico. Bureau of American Ethnology Bulletin 157. Washington, DC: Smithsonian Institution / GPO.",
  "url": "https://repository.si.edu/",
  "access_date": "2026-10-12",
  "reliability_tier": "P",
  "notes": "Primary BAE bulletin on Rio Chiquito / San Lorenzo-area stone monuments from Smithsonian–National Geographic work. Historical recording standards.",
  "editorial": {
    "derived_from": [
      "sources/src-olmec-stirling-bae-157-1955.md"
    ],
    "derived_on": "2026-10-12",
    "notes": "Bibliographic details verified via WebSearch/catalog pages 2026-10-12; no invented page numbers. Density pass 3 (D-2026-10-12-2)."
  }
}
