{
  "id": "src-teotihuacan-spence-obsidian-orientation",
  "entity": "source",
  "type": "article",
  "citation": "Spence, Michael W. Obsidian production and exchange studies at Teotihuacan.",
  "url": null,
  "access_date": null,
  "reliability_tier": "S",
  "notes": "Obsidian economy orientation.",
  "editorial": {
    "derived_from": [
      "tools/wave1_shells/densify_wave1.py",
      "docs/coverage-map.md",
      "docs/decisions.md#d-2026-10-12-13"
    ],
    "derived_on": "2026-10-12",
    "notes": "Wave-1 densify to library-seed-rich (D-2026-10-12-13). No invented pages/coords/finds/media art. Honest thin > fake dense."
  }
}
