{
  "id": "src-pueblo-judge-orientation",
  "entity": "source",
  "type": "article",
  "citation": "Judge, W. James — Chaco Canyon research and San Juan Basin survey tradition.",
  "url": null,
  "access_date": null,
  "reliability_tier": "S",
  "notes": "Chaco research orientation pointer.",
  "editorial": {
    "derived_from": [
      "tools/wave3_shells/densify_wave3.py",
      "docs/coverage-map.md",
      "docs/decisions.md#d-2026-10-12-17"
    ],
    "derived_on": "2026-10-12",
    "notes": "Wave-3 densify to library-seed-rich (D-2026-10-12-17). No invented pages/coords/finds/media art. Honest thin > fake dense."
  }
}
