{
  "id": "src-rapanui-shepardson-orientation",
  "entity": "source",
  "type": "monograph",
  "citation": "Shepardson, Britton L. — moai spatial analysis and conservation studies.",
  "url": null,
  "access_date": null,
  "reliability_tier": "S",
  "notes": "Spatial/conservation orientation; ethics-aware.",
  "editorial": {
    "derived_from": [
      "tools/wave3_shells/densify_wave3.py",
      "docs/coverage-map.md",
      "docs/decisions.md#d-2026-10-12-17"
    ],
    "derived_on": "2026-10-12",
    "notes": "Wave-3 densify to library-seed-rich (D-2026-10-12-17). No invented pages/coords/finds/media art. Honest thin > fake dense."
  }
}
