{
  "id": "src-phoenician-aubet-west-2001",
  "entity": "source",
  "type": "monograph",
  "citation": "Aubet, Maria Eugenia. 2001. The Phoenicians and the West: Politics, Colonies and Trade. 2nd ed. Cambridge: Cambridge University Press.",
  "url": null,
  "access_date": null,
  "reliability_tier": "S",
  "notes": "Standard synthesis of Phoenician western expansion; print.",
  "editorial": {
    "derived_from": [
      "tools/wave2_shells/generate_wave2.py",
      "docs/coverage-map.md",
      "docs/decisions.md#d-2026-10-12-14"
    ],
    "derived_on": "2026-10-12",
    "notes": "Wave-2 library-seed shell (D-2026-10-12-14). Abstract/TOC-level claims only; no invented pages, coords, or finds."
  }
}
