{
  "id": "src-bmac-francfort-seed-k",
  "entity": "source",
  "type": "monograph",
  "citation": "Francfort — Bactrian archaeology Seed K.",
  "url": null,
  "access_date": null,
  "reliability_tier": "S",
  "notes": "Bactria synthesis.",
  "editorial": {
    "derived_from": [
      "tools/hot_densify/densify_seed_batch_k.py",
      "docs/coverage-map.md",
      "docs/decisions.md#d-2026-10-13-05"
    ],
    "derived_on": "2026-10-13",
    "notes": "Seed densify Batch K toward ~71 sources (D-2026-10-13-05). No invented pages/coords/finds/media. Status stays library-seed-rich."
  }
}
