{
  "id": "src-indus-majumdar-sind-1934",
  "entity": "source",
  "type": "excavation-report",
  "citation": "Majumdar, N. G. 1934. Explorations in Sind: Being a Report of the Exploratory Survey Carried Out during the Years 1927–28, 1929–30, and 1930–31. Memoirs of the Archaeological Survey of India 48. Delhi: Manager of Publications.",
  "url": "https://archive.org/details/in.ernet.dli.2015.36186",
  "access_date": "2026-10-11",
  "reliability_tier": "P",
  "notes": "Primary ASI Memoir 48 documenting Majumdar’s exploratory survey in Sind (including recognition of Amri-type material later excavated by Casal). Digitized via Digital Library of India / Internet Archive (accessed 2026-10-11). No invented page-level find lists.",
  "editorial": {
    "derived_from": [
      "sources/src-indus-majumdar-sind-1934.md"
    ],
    "derived_on": "2026-10-11",
    "notes": "Second density pass D-2026-10-11-29; bibliographic details verified via WebSearch/catalogs; no invented page numbers/coordinates/forged images."
  }
}
