{
  "id": "src-aegean-hood-bronze-age-palace-knossos-1981",
  "entity": "source",
  "type": "excavation-report",
  "citation": "Hood, Sinclair, and William Taylor. 1981. The Bronze Age Palace at Knossos: Plan and Sections. BSA Supplementary Volume 13. London: British School at Athens / Thames and Hudson.",
  "url": null,
  "access_date": "2026-10-12",
  "reliability_tier": "P",
  "notes": "Primary BSA Supplementary Volume publishing plans and sections of the Knossos Bronze Age palace. Distinct from Hood The Minoans 1971 already registered.",
  "editorial": {
    "derived_from": [
      "sources/src-aegean-hood-bronze-age-palace-knossos-1981.md"
    ],
    "derived_on": "2026-10-12",
    "notes": "Density pass 5 (D-2026-10-12-6); bibliographic details verified via WebSearch/catalog pages 2026-10-12; no invented page numbers/coordinates/forged images."
  }
}
