{
  "id": "src-chavin-epigonal-transition",
  "entity": "source",
  "type": "article",
  "citation": "Epigonal / post-Chavín transition discussion literature.",
  "url": null,
  "access_date": null,
  "reliability_tier": "S",
  "notes": "Epigonal transition orientation.",
  "editorial": {
    "derived_from": [
      "tools/hot_densify/densify_seed_batch_d.py",
      "docs/coverage-map.md",
      "docs/decisions.md#d-2026-10-12-25"
    ],
    "derived_on": "2026-10-12",
    "notes": "Hot-pack densify Round-2 toward denser archive (D-2026-10-12-25). No invented pages/coords/finds/media art. Status stays library-seed-rich (still below Egypt-level fact-library)."
  }
}
