{
  "id": "src-hittite-lions-gate-r3b",
  "entity": "source",
  "type": "article",
  "citation": "Hattusa Lions Gate / fortifications deepen Round-3 B.",
  "url": null,
  "access_date": null,
  "reliability_tier": "S",
  "notes": "Lions Gate R3B.",
  "editorial": {
    "derived_from": [
      "tools/hot_densify/densify_hot_round3_b.py",
      "docs/coverage-map.md",
      "docs/decisions.md#d-2026-10-12-29"
    ],
    "derived_on": "2026-10-12",
    "notes": "Hot-pack densify Round-2 toward denser archive (D-2026-10-12-29). No invented pages/coords/finds/media art. Status stays library-seed-rich (still below Egypt-level fact-library)."
  }
}
