{
  "id": "src-nuragic-su-tempiesu-seed-j",
  "entity": "source",
  "type": "article",
  "citation": "Su Tempiesu sacred well Seed J.",
  "url": null,
  "access_date": null,
  "reliability_tier": "S",
  "notes": "Sacred well Seed J.",
  "editorial": {
    "derived_from": [
      "tools/hot_densify/densify_seed_batch_j.py",
      "docs/coverage-map.md",
      "docs/decisions.md#d-2026-10-13-04"
    ],
    "derived_on": "2026-10-13",
    "notes": "Seed densify Batch J toward ~48 sources (D-2026-10-13-04). No invented pages/coords/finds/media. Status stays library-seed-rich."
  }
}
